{
  "engagement_id": "eng_smoke_20260822",
  "pipeline_mode": "pipeline1_public_low_impact",
  "public_observation": {
    "acknowledged": true,
    "acknowledged_at": "2026-08-22T00:00:00Z",
    "acknowledged_by": "operator-controlled-integration-test"
  },
  "environment": {
    "targets": [
      {
        "host": "target.canary.test",
        "ip": "172.30.0.10",
        "port": 8080,
        "rate_per_second": 1,
        "max_concurrency": 1,
        "max_requests": 1
      }
    ],
    "external_apis": [],
    "authoritative_ns": [],
    "dns_resolver_ip": "1.1.1.1",
    "canary_image": "curlimages/curl:8.15.0@sha256:4026b29997dc7c823b51c164b71e2b51e0fd95cce4601f78202c513d97da2922"
  },
  "emergency_stop": {
    "script": "eng-stop.sh",
    "owner": "operator-controlled-integration-test"
  },
  "canary": {
    "negative_url": "http://negative.canary.test:8080/health",
    "negative_ip": "172.31.0.10",
    "negative_port": 8080,
    "positive_url": "http://target.canary.test:8080/health",
    "positive_ip": "172.30.0.10",
    "positive_port": 8080
  }
}
